{
  "id": "MIG-7",
  "criteria_sha256": "5236c5e00f71703afc98e3a77653d2c136b889ebd6f531bb3e226d4d8541993b",
  "criteria": {
    "C1": {
      "status": "FAIL",
      "evidence": "test",
      "run": null
    },
    "C2": {
      "status": "FAIL",
      "evidence": "test",
      "run": null
    },
    "C3": {
      "status": "FAIL",
      "evidence": "test",
      "run": null
    },
    "C4": {
      "status": "FAIL",
      "evidence": "check",
      "run": null
    },
    "C5": {
      "status": "FAIL",
      "evidence": "manual",
      "run": null
    },
    "C6": {
      "status": "FAIL",
      "evidence": "test",
      "run": null
    },
    "review:mason": {
      "status": "FAIL",
      "evidence": "manual",
      "run": null
    },
    "review:warden": {
      "status": "FAIL",
      "evidence": "manual",
      "run": null
    }
  },
  "updated_at": "2026-10-09T20:55:36Z"
}
