{
  "id": "USE-51",
  "criteria_sha256": "a19c84f3480430892a8b9713333b40f2f55791d3fc6332f46a81a45d3a882938",
  "criteria": {
    "C1": {
      "status": "FAIL",
      "evidence": "capture",
      "run": null
    },
    "C2": {
      "status": "FAIL",
      "evidence": "capture",
      "run": null
    },
    "C3": {
      "status": "FAIL",
      "evidence": "capture",
      "run": null
    },
    "C4": {
      "status": "FAIL",
      "evidence": "capture",
      "run": null
    },
    "C5": {
      "status": "FAIL",
      "evidence": "test",
      "run": null
    },
    "C6": {
      "status": "FAIL",
      "evidence": "check",
      "run": null
    },
    "C7": {
      "status": "FAIL",
      "evidence": "check",
      "run": null
    }
  },
  "built_at": "2026-10-18T18:57:36Z",
  "updated_at": "2026-10-18T18:57:36Z"
}
