{
  "id": "WEB-1",
  "criteria_sha256": "3e5599f1dcc65f399580c98f534ba989b325c12a6e76d10bd36892cd23b37efa",
  "criteria": {
    "C1": {
      "status": "PASS",
      "evidence": "test",
      "run": {
        "command": "yarn test:tooling --test-name-pattern C1",
        "exit": 0,
        "at": "2026-10-02T12:00:00Z",
        "head": "0123456789abcdef0123456789abcdef01234567",
        "evidence_path": "tooling/fixtures/specs/pass-cost-block/specs/web/one-offs/WEB-1-filter/evidence/C1.log",
        "evidence_sha256": "5ddcfb150e16f8d76db62fd10728e84af2fbbc8fc1d364e433fda0417e83327e",
        "tests": 3
      }
    },
    "C2": {
      "status": "FAIL",
      "evidence": "check",
      "run": null
    },
    "C3": {
      "status": "FAIL",
      "evidence": "manual",
      "run": null
    }
  },
  "cost": {
    "at": "2026-10-02T13:00:00Z",
    "calls": 5,
    "weighted": 3810,
    "tokens_input": 8,
    "tokens_cache_read": 16500,
    "tokens_cache_write": 400,
    "tokens_output": 250,
    "by_category": {
      "build": {
        "calls": 3,
        "weighted": 2808
      },
      "proofs": {
        "calls": 2,
        "weighted": 1002
      },
      "captures": {
        "calls": 0,
        "weighted": 0
      },
      "reviews": {
        "calls": 0,
        "weighted": 0
      },
      "status": {
        "calls": 0,
        "weighted": 0
      },
      "git": {
        "calls": 0,
        "weighted": 0
      },
      "re-reading": {
        "calls": 0,
        "weighted": 0
      },
      "other": {
        "calls": 0,
        "weighted": 0
      }
    },
    "context_last_call": 6302,
    "threads": 2,
    "headless_runs": 0,
    "headless_weighted": 0
  },
  "updated_at": "2026-10-02T13:00:00Z"
}
