{
  "id": "USE-7",
  "criteria_sha256": "1fdea554d0fb4e189629db119343e6ff37009fc777e892dbd8dffb8e03cbcf6a",
  "criteria": {
    "C1": {
      "status": "FAIL",
      "evidence": "test",
      "run": null
    },
    "C2": {
      "status": "FAIL",
      "evidence": "test",
      "run": null
    },
    "C3": {
      "status": "FAIL",
      "evidence": "test",
      "run": null
    },
    "C4": {
      "status": "FAIL",
      "evidence": "test",
      "run": null
    },
    "C5": {
      "status": "FAIL",
      "evidence": "test",
      "run": null
    },
    "C6": {
      "status": "FAIL",
      "evidence": "test",
      "run": null
    },
    "C8": {
      "status": "FAIL",
      "evidence": "test",
      "run": null
    },
    "C7": {
      "status": "FAIL",
      "evidence": "check",
      "run": null
    }
  },
  "built_at": "2026-10-18T18:50:17Z",
  "updated_at": "2026-10-18T18:50:17Z"
}
