{
  "id": "USE-5",
  "criteria_sha256": "390bdd263c5de8416ef4ec6d4b91579b544461ed2fb947ecfde37349c4bff9eb",
  "criteria": {
    "C1": {
      "status": "FAIL",
      "evidence": "test",
      "run": null
    },
    "C2": {
      "status": "FAIL",
      "evidence": "test",
      "run": null
    },
    "C3": {
      "status": "FAIL",
      "evidence": "test",
      "run": null
    },
    "C4": {
      "status": "FAIL",
      "evidence": "test",
      "run": null
    },
    "C5": {
      "status": "FAIL",
      "evidence": "test",
      "run": null
    },
    "C6": {
      "status": "FAIL",
      "evidence": "test",
      "run": null
    },
    "C7": {
      "status": "FAIL",
      "evidence": "test",
      "run": null
    },
    "C8": {
      "status": "FAIL",
      "evidence": "check",
      "run": null
    }
  },
  "built_at": "2026-10-18T18:50:09Z",
  "updated_at": "2026-10-18T18:50:09Z"
}
