{
  "id": "USE-45",
  "criteria_sha256": "6b271c5ba3dea5f4fc48fff8fd2839ff5668483bc59c6b956af04b88d3e73eb3",
  "criteria": {
    "C1": {
      "status": "FAIL",
      "evidence": "capture",
      "run": null
    },
    "C2": {
      "status": "FAIL",
      "evidence": "capture",
      "run": null
    },
    "C3": {
      "status": "FAIL",
      "evidence": "capture",
      "run": null
    },
    "C4": {
      "status": "FAIL",
      "evidence": "capture",
      "run": null
    },
    "C5": {
      "status": "FAIL",
      "evidence": "capture",
      "run": null
    },
    "C6": {
      "status": "FAIL",
      "evidence": "capture",
      "run": null
    },
    "C7": {
      "status": "FAIL",
      "evidence": "check",
      "run": null
    },
    "C8": {
      "status": "FAIL",
      "evidence": "check",
      "run": null
    }
  },
  "built_at": "2026-10-18T18:56:04Z",
  "updated_at": "2026-10-18T18:56:04Z"
}
