{
  "id": "WEB-1",
  "criteria_sha256": "0914ca5bfe0816223c2c42326d956fbfd2d26558881aaacaf065b934d0ad199c",
  "criteria": {
    "C1": {
      "status": "FAIL",
      "evidence": "capture",
      "run": null
    },
    "C2": {
      "status": "FAIL",
      "evidence": "capture",
      "run": null
    },
    "C3": {
      "status": "FAIL",
      "evidence": "capture",
      "run": null
    },
    "C4": {
      "status": "FAIL",
      "evidence": "capture",
      "run": null
    },
    "C5": {
      "status": "FAIL",
      "evidence": "check",
      "run": null
    },
    "C6": {
      "status": "FAIL",
      "evidence": "check",
      "run": null
    },
    "C7": {
      "status": "FAIL",
      "evidence": "check",
      "run": null
    },
    "C8": {
      "status": "FAIL",
      "evidence": "manual",
      "run": null
    }
  },
  "updated_at": "2026-10-10T00:20:35Z"
}
