{
  "id": "USE-83",
  "criteria_sha256": "e886bfc8b16ad127c41cad33a3e72d6a45fd13cfa9c69337cb84f612a8d927c7",
  "criteria": {
    "C1": {
      "status": "FAIL",
      "evidence": "capture",
      "run": null
    },
    "C2": {
      "status": "FAIL",
      "evidence": "capture",
      "run": null
    },
    "C3": {
      "status": "FAIL",
      "evidence": "capture",
      "run": null
    },
    "C4": {
      "status": "FAIL",
      "evidence": "capture",
      "run": null
    },
    "C5": {
      "status": "PASS",
      "evidence": "check",
      "run": {
        "command": "yarn check-types",
        "exit": 0,
        "at": "2026-10-18T19:23:40Z",
        "head": "ee9ae266e3894185ceaa062edd1f96dc703761f9",
        "evidence_path": "specs/web/epics/USE-daily-use/tickets/USE-083-avatar-menu-install/evidence/C5.log",
        "evidence_sha256": "820875cce629aaf01f8aa4c57fc9a2a44e17b660609f43e069952b22e0644664"
      }
    },
    "C6": {
      "status": "PASS",
      "evidence": "check",
      "run": {
        "command": "yarn lint",
        "exit": 0,
        "at": "2026-10-18T19:23:42Z",
        "head": "ee9ae266e3894185ceaa062edd1f96dc703761f9",
        "evidence_path": "specs/web/epics/USE-daily-use/tickets/USE-083-avatar-menu-install/evidence/C6.log",
        "evidence_sha256": "7b060bf954623d9456c01ed57b797fa6597787bf190b3c2494dee397c9e4bc8c"
      }
    }
  },
  "built_at": "2026-10-18T19:01:24Z",
  "updated_at": "2026-10-18T19:23:42Z"
}
