{
  "id": "WEB-1",
  "criteria_sha256": "3e5599f1dcc65f399580c98f534ba989b325c12a6e76d10bd36892cd23b37efa",
  "criteria": {
    "C1": {
      "status": "PASS",
      "evidence": "test",
      "run": {
        "command": "yarn test:tooling --test-name-pattern C1",
        "exit": 0,
        "at": "2026-10-02T12:00:00Z",
        "head": "0123456789abcdef0123456789abcdef01234567",
        "evidence_path": "tooling/fixtures/specs/pass-closed-one-off/specs/web/one-offs/WEB-1-filter/evidence/C1.log",
        "evidence_sha256": "5ddcfb150e16f8d76db62fd10728e84af2fbbc8fc1d364e433fda0417e83327e",
        "tests": 3
      }
    },
    "C2": {
      "status": "PASS",
      "evidence": "check",
      "run": {
        "command": "yarn check-types:tooling",
        "exit": 0,
        "at": "2026-10-02T12:00:00Z",
        "head": "0123456789abcdef0123456789abcdef01234567",
        "evidence_path": "tooling/fixtures/specs/pass-closed-one-off/specs/web/one-offs/WEB-1-filter/evidence/C2.log",
        "evidence_sha256": "046a49f4b08b6347ec383b2a102d5def60bf6a442171df060b8cb3db24a07562"
      }
    },
    "C3": {
      "status": "PASS",
      "evidence": "manual",
      "run": {
        "command": "yarn contract:record WEB-1 C3 --evidence tooling/fixtures/specs/pass-closed-one-off/specs/web/one-offs/WEB-1-filter/evidence/C3.log",
        "exit": 0,
        "at": "2026-10-02T12:00:00Z",
        "head": "0123456789abcdef0123456789abcdef01234567",
        "evidence_path": "tooling/fixtures/specs/pass-closed-one-off/specs/web/one-offs/WEB-1-filter/evidence/C3.log",
        "evidence_sha256": "b40f36ca1aaae675ea8efae80a53ef12ba75cdc718521fb1d57fd3150bbc0fc7"
      }
    }
  },
  "updated_at": "2026-10-02T12:00:00Z"
}
